{"action_ceiling":"仅限分析、补证与可逆试探的候选建议；不授权任何现实处置，不得据此强制返岗、永久远程、监控或惩罚。","central_claim_id":"CLAIM-A2-CENTRAL","judgment_strength":"moderate","locked_at":"2026-07-23T08:54:00Z","position":"VERDICT[rejects] 远程办公必然摧毁组织信任；该必然命题不成立。现有研究呈异质且条件依赖的结果，材料中的“绝不会”也只是立场而非证据。","primary_reasons":["中心命题“远程办公必然摧毁组织信任”要求无反例，但直接信任研究报告同一个人远程工时增加时组织信任上升，而同事与主管信任未显著变化。","全员远程可能收缩协作网络，混合安排也可能提高满意度和留任；方向取决于办公形式、岗位、治理与结果变量。","用户没有提供组织边界、时间窗、信任基线、岗位分层或因果比较，“绝不会”不能替代这些证据。","将结论限定为否定“必然摧毁”，不把它升级为“绝不会损害”；远程安排在特定治理、岗位和时间窗下仍可能降低信任。"],"proposition_verdict":"VERDICT[rejects] 远程办公必然摧毁组织信任","relation_to_proposition":"rejects","run_id":"promax-green-v4-gpt-5-6-sol-a2-9742973771c64e89813a768c7894faa8","runner_up_explanation":"次强解释是协作拓扑收缩机制，因为全员远程可能减少跨团队桥接；但它仍不足以证明所有组织、岗位和治理条件下都必然摧毁信任。","schema_id":"crossframe.promax.v8.position","schema_version":1,"source_snapshot_sha256":"3186805a3e46e1b16948a4e51d08e7693a8e0dd04aa6b4604e796266d649936c","strongest_counterevidence":["微软自然实验显示全员远程使协作网络更静态、更孤岛化；若信任依赖跨团队信息桥，远程可能通过该通道持续侵蚀组织信任。"],"why_not_adopted":["该微软研究支持协作拓扑风险，却没有直接测量组织信任，也不能覆盖混合、自愿或治理补偿不同的安排。","即使跨团队信息桥受损，仍需证明该通道在本案组织中实际存在、先于信任下降且竞争解释不足。"],"withdrawal_conditions":["如果未来在预注册的组织内重复比较中复现下述反方命题，则撤回当前中度拒绝并改为混合或支持：微软自然实验显示全员远程使协作网络更静态、更孤岛化；若信任依赖跨团队信息桥，远程可能通过该通道持续侵蚀组织信任。","如果新的直接信任证据跨岗位、团队与时间窗一致显示远程指定通道造成实质且不可被治理修复的下降，则降低或撤回本判断。"]}
