{"action_ceiling":"本输出仅作分析，不授权任何现实处置；试验、监测、岗位调整和退出安排均需要另行授权与独立审查。","central_claim_id":"CLAIM-REMOTE-TRUST-UNIVERSAL","judgment_strength":"moderate","locked_at":"2026-07-23T00:51:00+08:00","position":"VERDICT[rejects] 远程办公必然摧毁组织信任。当前 moderate 判断是否定“必然摧毁”：远程办公不是单一机制，而是经办公形态、治理反馈、弱联系、岗位处境与时间累积共同作用；材料只有姿态句，不能把条件性风险写成普遍确定律。","primary_reasons":["治理与反馈中介机制是当前领先解释：远程制度透明度、反馈回路、申诉保护和修复写回能够产生与地点标签不同的可观察信号。","证据契约与五向检索显示，外部研究既观察到协作孤岛和弱联系损失，也观察到信任维持、虚拟性负效应边界与混合办公无绩效损害，因此不能支持全称必然性。","D0-SP、D3、E5 与 MC* 要求把个人、团队、跨团队网络和组织制度分层，并把 M 资源条件与 Ψ 信任意义分开；局部结果不能无损迁移到组织整体。","把对“必然摧毁”的否定保持为 moderate，并把全远程、互赖度、反馈质量、新人处境与时间窗写成撤回门，而不是宣称远程办公通常无害。"],"proposition_verdict":"VERDICT[rejects] 远程办公必然摧毁组织信任","relation_to_proposition":"rejects","run_id":"promax-green-v3-gpt-5-6-sol-a1-f2bde4ebcefa435fbf4be12cf278730b","runner_up_explanation":"媒介收缩与弱联系损失机制是次优解释；若长期全远程且跨团队非正式接触持续减少，同时新人占比高、任务互赖强而弱联系替代通道不足，它会反超治理机制。","schema_id":"crossframe.promax.v8.position","schema_version":1,"source_snapshot_sha256":"3186805a3e46e1b16948a4e51d08e7693a8e0dd04aa6b4604e796266d649936c","strongest_counterevidence":["在高度互赖、长期全远程、低文档化、低反馈且新人占比较高的组织中，远程办公可能通过非正式线索与弱联系持续丧失而显著侵蚀组织信任。","Microsoft 网络研究观察到远程阶段协作网络更静态、更孤岛化、桥接减少，且接近同事的反馈利益对资历较浅成员更重要。"],"why_not_adopted":["该反方把全远程、低文档化、低反馈和新人占比高写成条件，因而支持条件性风险；但它不能推出远程办公在所有组织都必然摧毁组织信任。"],"withdrawal_conditions":["如果获得组织内重复测量并确认“在高度互赖、长期全远程、低文档化、低反馈且新人占比较高的组织中，远程办公可能通过非正式线索与弱联系持续丧失而显著侵蚀组织信任。”，且对照治理修复与岗位分层后仍出现跨团队信任持续下降，我将撤回 rejects、把判断调整为 mixed 或 supports，并提高强度。","若任何试探、测量或退出安排出现报复、隐私侵害、关键服务下降或不可逆岗位损失，则停止建议并降级为保护审查。"]}
