{"action_ceiling":"本分析仅作分析且不授权任何现实行动；试验、制度调整、退出或救济需要另行授权与独立复核。","central_claim_id":"CLAIM-REMOTE-TRUST-INEVITABILITY","judgment_strength":"moderate","locked_at":"2026-07-23T09:10:00+08:00","position":"VERDICT[rejects] 远程办公必然摧毁组织信任。在仅有一句材料且检索显示条件性反向路径存在时，不能成立为必然因果判断。","primary_reasons":["远程办公必然摧毁组织信任 的全称结构被存在条件性反向研究与竞争机制这一点削弱；机制二：治理替代与公平可见性说明地点不是唯一解释。","修正：把结论限定为拒绝“一定会摧毁”的必然性，而不否认某些条件下可能出现信任摩擦。"],"proposition_verdict":"VERDICT[rejects] 远程办公必然摧毁组织信任","relation_to_proposition":"rejects","run_id":"promax-run-dd7c57f21d368fd0","runner_up_explanation":"机制一：关系接触损失仍是重要的次要路径，因为高互赖工作缺少可替代的非正式互动与及时澄清接口时，摩擦可能累积；但它不能推出所有组织必然受损。","schema_id":"crossframe.promax.v8.position","schema_version":1,"source_snapshot_sha256":"3186805a3e46e1b16948a4e51d08e7693a8e0dd04aa6b4604e796266d649936c","strongest_counterevidence":["在缺少具体组织的基线、岗位结构、信任测量和时间序列时，不能从任何一般研究推出该组织不会或会遭受远程办公造成的信任下降。"],"why_not_adopted":["在缺少具体组织的基线、岗位结构、信任测量和时间序列时，不能从任何一般研究推出该组织不会或会遭受远程办公造成的信任下降。 但该反方限制的是对具体组织作正反向实证断言，并不恢复“必然摧毁”的全称命题；因此保留中等强度的拒绝。"],"withdrawal_conditions":["若获得同一组织的预注册、分岗位重复测量而且结果稳定显示地点安排本身造成不可接受的信任下降，则撤回当前拒绝：在缺少具体组织的基线、岗位结构、信任测量和时间序列时，不能从任何一般研究推出该组织不会或会遭受远程办公造成的信任下降。"]}
